{"schemaVersion":"1.1.0","variant":{"id":"chr4-81735000-C-A","chromosome":"chr4","position":81735000,"ref":"C","alt":"A","rsid":null,"gene":"RASGEF1B"},"provenance":{"source":"atlas-api","clientVersion":"0.9.0","pipelineVersion":"0.1.0","queriedAt":"2026-09-11T12:35:18Z","configHash":"db3b92963bb4600a","calibrationEpoch":"quantiles>=2026-06-18,indels>=2026-07-14","scorers":["AVI_SCORE","AVI_SCORE_FEATURE_IMPORTANCE","AVI_SCORE_MODEL_FEATURES","RNA_SEQ","ATAC","DNASE","CAGE","PROCAP","CHIP_TF","CHIP_HISTONE","SPLICE_SITE_USAGE","SPLICE_JUNCTIONS","POLYADENYLATION","CONTACT_MAPS"],"hasQuantiles":true},"modalities":[{"id":"RNA_SEQ","label":"RNA-seq","signed":true,"unit":null},{"id":"ATAC","label":"ATAC","signed":true,"unit":null},{"id":"DNASE","label":"DNase","signed":true,"unit":null},{"id":"CAGE","label":"CAGE","signed":true,"unit":null},{"id":"PROCAP","label":"PRO-cap","signed":true,"unit":null},{"id":"CHIP_TF","label":"ChIP TF","signed":true,"unit":null},{"id":"CHIP_HISTONE","label":"ChIP histonas","signed":true,"unit":null},{"id":"SPLICE_SITE_USAGE","label":"Uso de sitio de splicing","signed":false,"unit":null},{"id":"SPLICE_JUNCTIONS","label":"Uniones de splicing","signed":false,"unit":null},{"id":"POLYADENYLATION","label":"Poliadenilacion","signed":false,"unit":null},{"id":"CONTACT_MAPS","label":"Mapas de contacto","signed":false,"unit":null}],"organSystems":[{"id":"blood","label":"Sangre e inmune"},{"id":"cardiovascular","label":"Cardiovascular"},{"id":"digestive","label":"Digestivo"},{"id":"endocrine","label":"Endocrino"},{"id":"integumentary","label":"Piel y anexos"},{"id":"musculoskeletal","label":"Musculoesqueletico"},{"id":"nervous","label":"Sistema nervioso"},{"id":"renal","label":"Renal y urinario"},{"id":"reproductive","label":"Reproductor"},{"id":"respiratory","label":"Respiratorio"},{"id":"otros","label":"Otros"}],"biosamples":[{"id":"neuronal stem cell","label":"neuronal stem cell","ontologyCurie":"CL:0000047","biosampleType":"in_vitro_differentiated_cells","organSystem":"nervous"},{"id":"T-cell","label":"T-cell","ontologyCurie":"CL:0000084","biosampleType":"primary_cell","organSystem":"otros"},{"id":"endothelial cell","label":"endothelial cell","ontologyCurie":"CL:0000115","biosampleType":"in_vitro_differentiated_cells","organSystem":"cardiovascular"},{"id":"astrocyte","label":"astrocyte","ontologyCurie":"CL:0000127","biosampleType":"primary_cell","organSystem":"nervous"},{"id":"mesenchymal stem cell","label":"mesenchymal stem cell","ontologyCurie":"CL:0000134","biosampleType":"in_vitro_differentiated_cells","organSystem":"otros"},{"id":"type B pancreatic cell","label":"type B pancreatic cell","ontologyCurie":"CL:0000169","biosampleType":"in_vitro_differentiated_cells","organSystem":"digestive"},{"id":"hepatocyte","label":"hepatocyte","ontologyCurie":"CL:0000182","biosampleType":"in_vitro_differentiated_cells","organSystem":"digestive"},{"id":"myocyte","label":"myocyte","ontologyCurie":"CL:0000187","biosampleType":"in_vitro_differentiated_cells","organSystem":"musculoskeletal"},{"id":"smooth muscle cell","label":"smooth muscle cell","ontologyCurie":"CL:0000192","biosampleType":"in_vitro_differentiated_cells","organSystem":"musculoskeletal"},{"id":"ectodermal cell","label":"ectodermal cell","ontologyCurie":"CL:0000221","biosampleType":"in_vitro_differentiated_cells","organSystem":"otros"},{"id":"mesodermal cell","label":"mesodermal cell","ontologyCurie":"CL:0000222","biosampleType":"in_vitro_differentiated_cells","organSystem":"otros"},{"id":"endodermal cell","label":"endodermal cell","ontologyCurie":"CL:0000223","biosampleType":"in_vitro_differentiated_cells","organSystem":"otros"},{"id":"B cell","label":"B cell","ontologyCurie":"CL:0000236","biosampleType":"primary_cell","organSystem":"blood"},{"id":"keratinocyte","label":"keratinocyte","ontologyCurie":"CL:0000312","biosampleType":"primary_cell","organSystem":"integumentary"},{"id":"trophoblast cell","label":"trophoblast cell","ontologyCurie":"CL:0000351","biosampleType":"in_vitro_differentiated_cells","organSystem":"blood"},{"id":"skeletal muscle myoblast","label":"skeletal muscle myoblast","ontologyCurie":"CL:0000515","biosampleType":"primary_cell","organSystem":"musculoskeletal"},{"id":"natural killer cell","label":"natural killer cell","ontologyCurie":"CL:0000623","biosampleType":"primary_cell","organSystem":"blood"},{"id":"CD4-positive, alpha-beta T cell","label":"CD4-positive, alpha-beta T cell","ontologyCurie":"CL:0000624","biosampleType":"primary_cell","organSystem":"blood"},{"id":"CD8-positive, alpha-beta T cell","label":"CD8-positive, alpha-beta T cell","ontologyCurie":"CL:0000625","biosampleType":"primary_cell","organSystem":"blood"},{"id":"glutamatergic neuron","label":"glutamatergic neuron","ontologyCurie":"CL:0000679","biosampleType":"in_vitro_differentiated_cells","organSystem":"nervous"},{"id":"cardiac muscle cell","label":"cardiac muscle cell","ontologyCurie":"CL:0000746","biosampleType":"in_vitro_differentiated_cells","organSystem":"cardiovascular"},{"id":"CD4-positive, CD25-positive, alpha-beta regulatory T cell","label":"CD4-positive, CD25-positive, alpha-beta regulatory T cell","ontologyCurie":"CL:0000792","biosampleType":"primary_cell","organSystem":"blood"},{"id":"hematopoietic multipotent progenitor cell","label":"hematopoietic multipotent progenitor cell","ontologyCurie":"CL:0000837","biosampleType":"in_vitro_differentiated_cells","organSystem":"otros"},{"id":"mononuclear cell","label":"mononuclear cell","ontologyCurie":"CL:0000842","biosampleType":"primary_cell","organSystem":"otros"},{"id":"naive thymus-derived CD4-positive, alpha-beta T cell","label":"naive thymus-derived CD4-positive, alpha-beta T cell","ontologyCurie":"CL:0000895","biosampleType":"primary_cell","organSystem":"blood"},{"id":"CD4-positive, alpha-beta memory T cell","label":"CD4-positive, alpha-beta memory T cell","ontologyCurie":"CL:0000897","biosampleType":"primary_cell","organSystem":"blood"},{"id":"naive thymus-derived CD8-positive, alpha-beta T cell","label":"naive thymus-derived CD8-positive, alpha-beta T cell","ontologyCurie":"CL:0000900","biosampleType":"primary_cell","organSystem":"blood"},{"id":"CD14-positive monocyte","label":"CD14-positive monocyte","ontologyCurie":"CL:0001054","biosampleType":"primary_cell","organSystem":"blood"},{"id":"epithelial cell of proximal tubule","label":"epithelial cell of proximal tubule","ontologyCurie":"CL:0002306","biosampleType":"primary_cell","organSystem":"otros"},{"id":"neural cell","label":"neural cell","ontologyCurie":"CL:0002319","biosampleType":"in_vitro_differentiated_cells","organSystem":"otros"},{"id":"myoepithelial cell of mammary gland","label":"myoepithelial cell of mammary gland","ontologyCurie":"CL:0002324","biosampleType":"primary_cell","organSystem":"musculoskeletal"},{"id":"luminal epithelial cell of mammary gland","label":"luminal epithelial cell of mammary gland","ontologyCurie":"CL:0002326","biosampleType":"primary_cell","organSystem":"otros"},{"id":"mammary epithelial cell","label":"mammary epithelial cell","ontologyCurie":"CL:0002327","biosampleType":"primary_cell","organSystem":"otros"},{"id":"bronchial epithelial cell","label":"bronchial epithelial cell","ontologyCurie":"CL:0002328","biosampleType":"primary_cell","organSystem":"respiratory"},{"id":"progenitor cell of endocrine pancreas","label":"progenitor cell of endocrine pancreas","ontologyCurie":"CL:0002351","biosampleType":"in_vitro_differentiated_cells","organSystem":"digestive"},{"id":"myotube","label":"myotube","ontologyCurie":"CL:0002372","biosampleType":"in_vitro_differentiated_cells","organSystem":"musculoskeletal"},{"id":"mammary stem cell","label":"mammary stem cell","ontologyCurie":"CL:0002451","biosampleType":"primary_cell","organSystem":"otros"},{"id":"kidney epithelial cell","label":"kidney epithelial cell","ontologyCurie":"CL:0002518","biosampleType":"primary_cell","organSystem":"renal"},{"id":"aortic smooth muscle cell","label":"aortic smooth muscle cell","ontologyCurie":"CL:0002539","biosampleType":"primary_cell","organSystem":"musculoskeletal"},{"id":"mesenchymal stem cell of the bone marrow","label":"mesenchymal stem cell of the bone marrow","ontologyCurie":"CL:0002540","biosampleType":"primary_cell","organSystem":"blood"},{"id":"vein endothelial cell","label":"vein endothelial cell","ontologyCurie":"CL:0002543","biosampleType":"primary_cell","organSystem":"cardiovascular"},{"id":"thoracic aorta endothelial cell","label":"thoracic aorta endothelial cell","ontologyCurie":"CL:0002545","biosampleType":"primary_cell","organSystem":"cardiovascular"},{"id":"fibroblast of the aortic adventitia","label":"fibroblast of the aortic adventitia","ontologyCurie":"CL:0002547","biosampleType":"primary_cell","organSystem":"integumentary"},{"id":"fibroblast of dermis","label":"fibroblast of dermis","ontologyCurie":"CL:0002551","biosampleType":"primary_cell","organSystem":"integumentary"},{"id":"fibroblast of lung","label":"fibroblast of lung","ontologyCurie":"CL:0002553","biosampleType":"primary_cell","organSystem":"respiratory"},{"id":"mesenchymal stem cell of Wharton's jelly","label":"mesenchymal stem cell of Wharton's jelly","ontologyCurie":"CL:0002568","biosampleType":"primary_cell","organSystem":"otros"},{"id":"renal cortical epithelial cell","label":"renal cortical epithelial cell","ontologyCurie":"CL:0002584","biosampleType":"primary_cell","organSystem":"renal"},{"id":"endothelial cell of umbilical vein","label":"endothelial cell of umbilical vein","ontologyCurie":"CL:0002618","biosampleType":"primary_cell","organSystem":"cardiovascular"},{"id":"neural crest cell","label":"neural crest cell","ontologyCurie":"CL:0011012","biosampleType":"in_vitro_differentiated_cells","organSystem":"blood"},{"id":"mesothelial cell of epicardium","label":"mesothelial cell of epicardium","ontologyCurie":"CL:0011019","biosampleType":"in_vitro_differentiated_cells","organSystem":"otros"},{"id":"neural progenitor cell","label":"neural progen